Name,SIC,BVD
DONEAR INDUSTRIES LTD,2299.0,IN31452FI
DONG WOO SURFACE TECH ( INDIA ) PRIVATE LIMITED,3694.0,IN0007814163
DORADO CHEM PRIVATE LIMITED,2819.0,IN0007809628
DOSCH PHARMACEUTICALS PRIVATE LIMITED,8111.0,IN0008736959
DOTEX MERCHANDISE PRIVATE LIMITED,5085.0,IN0007805248
DOWELLS CABLE ACCESSORIES PRIVATE LIMITED,3462.0,IN0016583947
DR. AGARWAL'S EYE HOSPITAL LIMITED,6324.0,IN32766FI
DR. AGARWAL'S HEALTH CARE LIMITED,8099.0,IN0002507644
DS (ASSAM) HOSPITALITY LIMITED,7032.0,IN0000384318
DSM SHARED SERVICES INDIA PRIVATE LIMITED,7374.0,IN0007749002
DSS IMAGETECH PRIVATE LIMITED,3827.0,IN0007747296
DURGA PROCESSORS PRIVATE LIMITED,2711.0,IN0002788011
DURIAN INDUSTRIES LIMITED,5085.0,IN0004736505
DURR INDIA PRIVATE LIMITED,3562.0,IN0002791125
DWARKADHISH SAKHAR KARKHANA LIMITED,2061.0,IN0000244694
DYNAMIC FLOW PRODUCTS PRIVATE LIMITED,1041.0,IN0002793961
DYNAMIC TOOLS PRIVATE LIMITED,8711.0,IN0002552346
DYNATECH TOOLS & DEVICES (BENGALURU) PRIVATE LIMITED,3542.0,IN0002554415
DYSON TECHNOLOGY INDIA PRIVATE LIMITED,5085.0,IN0015877197
E FACTOR EXPERIENCES LIMITED,7911.0,IN0009309943
E-INFOCHIPS PRIVATE LIMITED,8711.0,IN0000275106
E.I.D. PARRY (INDIA) LIMITED,2063.0,IN30066FI
EAST COAST DISTRIBUTORS PRIVATE LIMITED,5085.0,IN0007856461
EAST END SILKS PRIVATE LIMITED,2281.0,IN0007854893
EAST INDIA TECHNOLOGIES PRIVATE LIMITED,3089.0,IN0007853145
EASTERN ELECTRODES & COKE PRIVATE LIMITED,2999.0,IN0007846717
EASTERN INTERNATIONAL HOTELS LIMITED,7021.0,IN0000257407
EASTMAN AUTO & POWER LIMITED,5085.0,IN0014443462
EASTMAN INDUSTRIES LIMITED,3751.0,IN0000244656
EASY TRIP PLANNERS LIMITED,4724.0,IN001266232IND
EBIXCASH GLOBAL SERVICES PRIVATE LIMITED,7371.0,IN0010692594
EBIXCASH WORLD MONEY LIMITED,6019.0,IN0000263911
ECOLAB FOOD SAFETY & HYGIENE SOLUTIONS PRIVATE LIMITED,2821.0,IN0007776646
ECOS (INDIA) MOBILITY & HOSPITALITY PRIVATE LIMITED,7389.0,IN0007772563
EDELMAN INDIA PRIVATE LIMITED,8742.0,IN0002560237
EDGIO SOLUTIONS INDIA PRIVATE LIMITED,7389.0,IN0008240667
EDWARDS LIFESCIENCES (INDIA) PRIVATE LIMITED,3841.0,IN0002805928
EFTEC (INDIA) PRIVATE LIMITED,3089.0,IN0000020771
EIH ASSOCIATED HOTELS LIMITED,7011.0,IN31929FI
ELECTRICA ENGINEERS (INDIA) PRIVATE LIMITED,3694.0,IN0007913762
ELECTROFAB INNOVATIONS (INDIA) PRIVATE LIMITED,3694.0,IN0007915999
ELECTROMECH INFRAPROJECTS PRIVATE LIMITED,3559.0,IN0012014868
ELECTROMECH MATERIAL HANDLING SYSTEMS (INDIA) PRIVATE LIMITED,3612.0,IN0007916382
ELECTRONIC ARTS GAMES (INDIA) PRIVATE LIMITED,7375.0,IN0000024607
ELECTROSTEEL CASTINGS LIMITED,3317.0,IN30592FI
ELKOS PENS LIMITED,3999.0,IN0007945074
ELVEETY INDUSTRIES PRIVATE LIMITED,191.0,IN0007953307
EMERGE GLASS INDIA PRIVATE LIMITED,3211.0,IN0013525917
EMPLOYTECH CENTER INDIA PRIVATE LIMITED,7375.0,IN0017127904
EMUDHRA LIMITED,7379.0,IN39771FI
ENAM ASSET MANAGEMENT COMPANY PRIVATE LIMITED,6159.0,IN0002866039
ENERSHELL ALLOYS & STEEL PRIVATE LIMITED,3312.0,IN0008697191
ENNORE CARGO CONTAINER TERMINAL PRIVATE LIMITED,4225.0,IN0008707208
ENPHASE SOLAR ENERGY PRIVATE LIMITED,7389.0,IN0017580157
ENPROCON ENTERPRISE LIMITED,3269.0,IN0008708854
ENRICH AGRO FOOD PRODUCTS PRIVATE LTD,139.0,IN0008709372
ENTERTAINMENT CITY LIMITED,7911.0,IN0015639815
ENTIGRITY PRIVATE LIMITED,7389.0,IN0017624429
ENVIRO INFRA ENGINEERS LIMITED,1629.0,IN0008717522
ENVIRON SPECIALITY CHEMICALS PRIVATE LIMITED,5093.0,IN0008718401
ENVISION SCIENTIFIC PRIVATE LIMITED,2834.0,IN0008720066
EPAM SYSTEMS INDIA PRIVATE LIMITED,8742.0,IN0000755108
EPHICACY LIFESCIENCE ANALYTICS PRIVATE LIMITED,8731.0,IN0007760235
EPI SOURCE INDIA PRIVATE LIMITED,7375.0,IN0007760012
EPIGRAL LIMITED,2899.0,IN116141FI
EPITOME PETROPACK LIMITED,2999.0,IN0007757501
EQ TECHNOLOGIC (INDIA) PRIVATE LIMITED,7375.0,IN0002583494
EQIC DIES AND MOULDS ENGINEERS PRIVATE LIMITED,3089.0,IN0002585544
EQUIFAX CREDIT INFORMATION SERVICES PRIVATE LIMITED,7374.0,IN0002582748
ESKAG SANJEEVANI PRIVATE LIMITED,8011.0,IN0002607445
ESKO CASTING AND ELECTRONICS PRIVATE LIMITED,1041.0,IN0002608839
ESPIRE CONGLOMERATE PRIVATE LIMITED,6021.0,IN0002611179
ESPIRE INFOLABS PRIVATE LIMITED,7371.0,IN0002611253
ESSEM TECNOPINZ PRIVATE LIMITED,3999.0,IN0002646553
ETERNAL SUNSHINE PRODUCTIONS PRIVATE LIMITED,7389.0,IN0015134299
ETERNO INFOTECH PRIVATE LIMITED,7371.0,IN0002597537
ETHOS LIMITED,5094.0,IN37719FI
EURO PANEL PRODUCTS LIMITED,3365.0,IN932757FI
EUROCOUSTIC PRODUCTS LIMITED,8111.0,IN0000272208
EUROFINS IT SOLUTIONS INDIA PRIVATE LIMITED,7371.0,IN0002663817
EUROSCHOOL FOUNDATION,8211.0,IN0002665164
EUROTECK ENVIRONMENTAL PRIVATE LIMITED,4941.0,IN0002666019
EUSTON INDUSTRIES LIMITED,7389.0,IN0015278073
EUTHORIA DEVELOPERS PRIVATE LIMITED,6531.0,IN0002666665
EVER ELECTRONICS PRIVATE LIMITED,3672.0,IN0002670561
EVEREST BUSINESS ADVISORY INDIA PRIVATE LIMITED,7389.0,IN0002672639
EVM AUTOKRAFT INDIA PRIVATE LIMITED,5012.0,IN0016079251
EVOLENT HEALTH INTERNATIONAL PRIVATE LIMITED,7375.0,IN0015686156
EXCEL CARS PRIVATE LIMITED,5085.0,IN0002691794
EXCEL METAL ENGINEERING PRIVATE LIMITED,3341.0,IN0002694654
EXOS IT MANAGEMENT PRIVATE LIMITED,7375.0,IN0016616991
EXOTECH PLASTICS PRIVATE LIMITED,3089.0,IN0002712681
EXOTIC FRUITS PRIVATE LIMITED,8062.0,IN0002713346
EXOTIC INNOVATIONS PRIVATE LIMITED,7389.0,IN0002713588
EXPERIAN CREDIT INFORMATION COMPANY OF INDIA PRIVATE LIMITED,6019.0,IN0004736144
EXPERION DEVELOPERS PRIVATE LIMITED,6512.0,IN0002715175
EXPLEO SOLUTIONS LIMITED,7378.0,IN34020FI
EXTENTIA INFORMATION TECHNOLOGY PRIVATE LIMITED,7371.0,IN0002723933
FAITH INDUSTRIES LIMITED,5085.0,IN0002740822
FALCON AUTOTECH PRIVATE LIMITED,3549.0,IN0002742786
FAMY LIFE SCIENCES PRIVATE LIMITED,4911.0,IN0002749183
FASHION WORLD GARMENTS PRIVATE LIMITED,2326.0,IN0002566121
FASHIONKING BRANDS PRIVATE LIMITED,3631.0,IN0010267838
FAURECIA EMISSIONS CONTROL TECHNOLOGIES INDIA PRIVATE LIMITED,3562.0,IN0002530702
FEATHERLITE PRODUCTS PRIVATE LIMITED,2421.0,IN0002826316
FEDBANK FINANCIAL SERVICES LIMITED,6141.0,IN0000279918
FENACE AUTO LIMITED,7389.0,IN0002831399
FERTILISERS AND CHEMICALS TRAVANCORE LIMITED,2875.0,IN30805FI
FG GLASS INDUSTRIES PRIVATE LIMITED,3211.0,IN0002837639
FINE JEWELLERY MANUFACTURING LIMITED,3911.0,IN0002851255
FINE ORGANIC INDUSTRIES LIMITED,2899.0,IN920125FI
FINEOTEX CHEMICAL LIMITED,2899.0,IN34620FI
FINORCHEM LIMITED,2819.0,IN0000235708
FINOVA CAPITAL PRIVATE LIMITED,6159.0,IN0015230122
FIRSTRAND SERVICES PRIVATE LIMITED,7371.0,IN0014544156
FISCHER BUILDING MATERIALS INDIA PRIVATE LIMITED,3694.0,IN0015637708
FISERV INDIA PRIVATE LIMITED,7375.0,IN0002871543
FIVE-STAR BUSINESS FINANCE LIMITED,6159.0,IN0002874645
FIXDERMA INDIA PRIVATE LIMITED,2834.0,IN0002876403
FLAIR WRITING INDUSTRIES LIMITED,5199.0,IN0016185097
FOCUS LIGHTING & FIXTURES LTD,3645.0,IN117597FI
FOODS AND INNS LIMITED,2099.0,IN33896FI
FORACE SPECIALITY CHEM PRIVATE LIMITED,3999.0,IN0015909393
FORAY SOFTWARE PRIVATE LIMITED,7371.0,IN0002908627
FORECH INDIA PRIVATE LIMITED,5199.0,IN0002910955
FORMING INDIA PRIVATE LIMITED,3441.0,IN0002916207
FORTUNE GOURMET SPECIALITIES PRIVATE LIMITED,5141.0,IN0002923238
FOSROC CHEMICALS (INDIA) PRIVATE LIMITED,2819.0,IN0002929409
FOWLER WESTRUP (INDIA) PRIVATE LIMITED,7389.0,IN0002938775
FRAGOMEN IMMIGRATION SERVICES INDIA PRIVATE LIMITED,8742.0,IN0002940443
FRANKE FABER INDIA PRIVATE LIMITED,2655.0,IN0000021213
FREEWILL SPORTS PRIVATE LIMITED,3949.0,IN0002947721
FRIMLINE PRIVATE LIMITED,2099.0,IN0015899414
FRITZMEIER MOTHERSON CABIN ENGINEERING PRIVATE LIMITED,3559.0,IN0002957227
FRONTIER RAAS PRIVATE LIMITED,5131.0,IN0002959631
FUCHS LUBRICANTS (INDIA) PRIVATE LIMITED,2999.0,IN0002965346
FUJI SILVERTECH CONCRETE PRIVATE LIMITED,3271.0,IN0014381987
FUSO GLASS INDIA PRIVATE LIMITED,3211.0,IN0002974622
G D GOENKA UNIVERSITY,8221.0,IN0003128396
G V G PAPER MILLS PRIVATE LIMITED,2611.0,IN0009328934
G.H. AGENCIES PRIVATE LIMITED,5085.0,IN0013771834
G.M.BREWERIES LIMITED,2085.0,IN34659FI
G.R.SPONGE AND POWER LIMITED,3312.0,IN0010442504
G.S. EXPRESS PRIVATE LIMITED,1629.0,IN0012736497
G.T.R. ALUMINIUM PRIVATE LIMITED,1041.0,IN0010442278
GAINSIGHT SOFTWARE PRIVATE LIMITED,7374.0,IN0007998968
GAJANAN FERRO PRIVATE LIMITED,3312.0,IN0002999178
GALDERMA INDIA PRIVATE LIMITED,2819.0,IN0000022868
GALIPOGLU HIDROMAS INDIA MANUFACTURING PRIVATE LIMITED,3531.0,IN0003013614
GALLANTT METAL LIMITED,3399.0,IN32084FI
GALLOPS AUTOHAUS PRIVATE LIMITED,5999.0,IN0017239532
GALLOPS MOTORS PRIVATE LIMITED,5012.0,IN0003015531
GANESH HOUSING CORPORATION LIMITED,6531.0,IN31935FI
GANGA MEDICAL CENTRE AND HOSPITALS PRIVATE LIMITED,4911.0,IN0003032588
GANGAUR EXPORTS PRIVATE LIMITED,5131.0,IN0003036401
GANGOTRI AYURVEDA PRIVATE LIMITED,2834.0,IN0003038263
GARDEN REACH SHIPBUILDERS & ENGINEERS LIMITED,3731.0,IN112393FI
GATES UNITTA INDIA COMPANY PRIVATE LIMITED,3069.0,IN0003064962
GAUTAM SOLAR PRIVATE LIMITED,3694.0,IN0019738731
GAVS TECHNOLOGIES PRIVATE LIMITED,7371.0,IN0003080136
GBTL LIMITED,2269.0,IN0003334269
GD RESEARCH CENTER PRIVATE LIMITED,8743.0,IN0007864639
GEBBS HEALTHCARE SOLUTIONS PRIVATE LIMITED,7375.0,IN0003092274
GEBERIT INDIA MANUFACTURING PRIVATE LIMITED,3999.0,IN0000400174
GEBERIT PLUMBING TECHNOLOGY INDIA PRIVATE LIMITED,4941.0,IN0000024177
GEBR.PFEIFFER (INDIA) PRIVATE LIMITED,7389.0,IN0003092395
GEDIA INDIA AUTOMOTIVE COMPONENTS PRIVATE LIMITED,3559.0,IN0003092858
GEECO ENERCON PRIVATE LIMITED,3398.0,IN0003095965
GEEKAY WIRES LIMITED,3496.0,IN117687FI
GEM PLAZA PRIVATE LIMITED,3911.0,IN0003105056
GENERAL ENERGY MANAGEMENT SYSTEMS PRIVATE LIMITED.,4911.0,IN0004739493
GENESIS LA MODE PRIVATE LIMITED,5199.0,IN0003117973
GENESYS INTERNATIONAL CORPORATION LIMITED,7379.0,IN30809FI
GENIE AUTO PRODUCTS PRIVATE LIMITED,3694.0,IN0003121294
GENSOL ENGINEERING LIMITED,8748.0,IN728377FI
GEO NUTRI FOODS PRIVATE LIMITED,2086.0,IN0003130703
GHANKUN STEELS PRIVATE LIMITED,3312.0,IN0003143266
GIRAFFE DEVELOPERS PRIVATE LIMITED,5085.0,IN0003159309
GIRIRAJ COATED FAB PRIVATE LIMITED,2269.0,IN0003163675
GK RICKSHAW LIMITED,3694.0,IN0016251812
GLF LIFESTYLE BRANDS PRIVATE LIMITED,5085.0,IN0003181842
GLOBANT INDIA PRIVATE LIMITED,7375.0,IN0002095855
GLOBE AUTOMOBILES PRIVATE LIMITED,5012.0,IN0003195849
GLOBEOP FINANCIAL SERVICES (INDIA) PRIVATE LIMITED,6019.0,IN0003197422
GLOBETROTTERS EDUCATIONAL INNOVENTIONS PRIVATE LIMITED,8299.0,IN0003197626
GLOVIS INDIA ANANTAPUR PRIVATE LIMITED,3694.0,IN0016983778
GLS INFRAPROJECTS PRIVATE LIMITED,6531.0,IN0011879847
GLS INFRATECH PRIVATE LIMITED,6512.0,IN0003207446
GML INDIA FASHION PRIVATE LIMITED,5131.0,IN0013012997
GMR ENERGY LIMITED,8062.0,IN0000226627
GOA CARBON LIMITED,3312.0,IN30491FI
GOA COASTAL RESORTS AND RECREATION PRIVATE LIMITED,7021.0,IN0003217931
GOAN HOTELS & REALTY PRIVATE LIMITED,7021.0,IN0000024785
GODAVARI COMMODITIES LTD,5085.0,IN0003223855
GOGREEN WAREHOUSES PRIVATE LIMITED,4789.0,IN0002950265
GOLD STAR ELITE JEWELS PRIVATE LIMITED,5021.0,IN0006890093
GOLDBRICKS INFRASTRUCTURE PRIVATE LIMITED,6531.0,IN0003243573
GOLDEN FLOOR FURNISHING PRIVATE LIMITED,2273.0,IN0003249466
GOODRICH CARBOHYDRATES LIMITED,2091.0,IN0003285759
GOODVIEW FASHION PRIVATE LIMITED,2326.0,IN0003287313
GOODWILL FABRICS PRIVATE LIMITED,2281.0,IN0003288624
GOPAL GLASS WORKS LIMITED,3211.0,IN0003293116
GOVERNMENT EMARKETPLACE,7389.0,IN0016623946
GOYAL HOSPITAL AND RESEARCH CENTRE PVT LTD,8062.0,IN0003313416
GRANT THORNTON ADVISORY PRIVATE LIMITED,8111.0,IN0003331761
GRAVISS FOODS PRIVATE LIMITED,2021.0,IN0003335998
GRAVITA INDIA LIMITED,1031.0,IN34612FI
GRAVITY INDUSTRIES PRIVATE LIMITED,3911.0,IN0014898083
GRAZIANO TRASMISSIONI INDIA PRIVATE LIMITED,3694.0,IN0000020329
GREAT WEST GLOBAL BUSINESS SERVICES INDIA PRIVATE LIMITED,7389.0,IN0013869053
GREEN GAS LIMITED,2999.0,IN0003353519
GREEN IVY VENTURES PRIVATE LIMITED,8099.0,IN0008812064
GREENFIELDS DERIVATIVES PRIVATE LIMITED,2047.0,IN0013302614
GREENPARK HOTELS AND RESORTS LIMITED,7021.0,IN0003377909
GREY ORANGE INDIA PRIVATE LIMITED,8742.0,IN0012179963
GRUNDFOS PUMPS INDIA PRIVATE LIMITED,3631.0,IN0003404898
GSPANN TECHNOLOGIES (INDIA) PRIVATE LIMITED,7371.0,IN0005009081
GUDI EXPORTS PRIVATE LIMITED,2326.0,IN0003409991
GUETERMANN INDIA PRIVATE LIMITED,5085.0,IN0003410621
GUIDEHOUSE INDIA PRIVATE LIMITED,7389.0,IN0006614909
GUJARAT MINERAL DEVELOPMENT CORPORATION LTD,1099.0,IN30573FI
GUJARAT ROAD AND INFRASTRUCTURE COMPANY LIMITED,6159.0,IN0000248378
GUJARAT RURAL INDUSTRIES MARKETING CORPORATION LIMITED,5199.0,IN0003417013
GUJARAT THEMIS BIOSYN LIMITED,2834.0,IN32063FI
GULF OIL LUBRICANTS INDIA LIMITED,2992.0,IN110228FI
GULSHAN CHEMICALS PRIVATE LIMITED,2834.0,IN0000256913
GUNINA COMMERCIALS PRIVATE LIMITED,7389.0,IN0003427754
GUNNEBO INDIA PRIVATE LIMITED,3312.0,IN0000237746
GURU NANAK AUTO ENTERPRISES LIMITED,7538.0,IN0003441211
H. K. JEWELS PRIVATE LIMITED,3911.0,IN0010604402
HAB PHARMACEUTICALS AND RESEARCH LIMITED,2834.0,IN0000266267
HACHETTE BOOK PUBLISHING INDIA PRIVATE LIMITED,2789.0,IN0003463109
HAITIAN HUAYUAN MACHINERY (INDIA) PRIVATE LIMITED,5085.0,IN0012314777
HALDYN HEINZ FINE GLASS PRIVATE LIMITED,3281.0,IN0014875225
HALMA INDIA PRIVATE LIMITED,7375.0,IN0003473062
HAMILTON WRITING INSTRUMENTS PRIVATE LIMITED,8743.0,IN0003475924
HAPPIEST MINDS TECHNOLOGIES LIMITED,7379.0,IN110654FI
HARDWYN INDIA LIMITED,3354.0,IN737268FI
HARIDWAR NATURAL GAS PRIVATE LIMITED,4939.0,IN0015820151
HARISONS STEEL LIMITED,3312.0,IN0003513279
HARMAN INTERNATIONAL (INDIA) PRIVATE LIMITED,3571.0,IN0000024678
HARSAHAIMAL SHIAMLAL JEWELLERS PRIVATE LIMITED,5999.0,IN0003524206
HARSCO INDIA METALS PRIVATE LIMITED,3312.0,IN0003524351
HARSHA AUTO AGENCIES PRIVATE LIMITED,5571.0,IN0003527073
HARSHA CARS PRIVATE LIMITED,5012.0,IN0003527118
HASBRO CLOTHING PRIVATE LIMITED,2326.0,IN0003539498
HATORKI MOTORS PRIVATE LIMITED,5013.0,IN0003543838
HAVELI RESTAURANT & RESORTS LIMITED,1629.0,IN0003544978
HAVMOR ICE CREAM PRIVATE LIMITED,2021.0,IN0020486081
HAY CONSULTANTS INDIA PRIVATE LIMITED,8742.0,IN0003547672
HAZOORILAL AND SONS JEWELLERS PRIVATE LIMITED,3911.0,IN0003550178
HCL AVITAS PRIVATE LIMITED,8099.0,IN0001597831
HDFC CAPITAL ADVISORS LIMITED,7389.0,IN0014436737
HDFC CREDILA FINANCIAL SERVICES LIMITED,6019.0,IN0002150928
HEALTH PRIME SERVICES (INDIA) PRIVATE LIMITED,7375.0,IN0008218607
HEERU CORROSION PROTECTION SERVICES INDIA PRIVATE LIMITED,3999.0,IN0007964882
HELLERMANNTYTON PRIVATE LIMITED,8721.0,IN0007969602
HELVOET RUBBER & PLASTIC TECHNOLOGIES (INDIA) PRIVATE LIMITED,3089.0,IN0007972666
HERBALIFE INTERNATIONAL INDIA PRIVATE LIMITED,5085.0,IN0007984873
HERCULES HOISTS LIMITED,3559.0,IN31221FI
HERITAGE BEVERAGES PRIVATE LIMITED,2084.0,IN0007987177
HERMES DISTILLERY PRIVATE LIMITED,2085.0,IN0008329216
HERMES INDIA RETAIL AND DISTRIBUTORS PRIVATE LIMITED,5999.0,IN0007990847
HIDESIGN INDIA PRIVATE LIMITED,4724.0,IN0003567473
HIGH GRADE INDUSTRIES (INDIA) PRIVATE LIMITED,2819.0,IN0003568974
HIGHRADIUS TECHNOLOGIES PRIVATE LIMITED,7371.0,IN0003577015
HIGHWAY ON WHEELS TRANSPORT PRIVATE LIMITED,5199.0,IN0014671397
HILLSON FOOTWEAR PRIVATE LIMITED,3021.0,IN0003583839
HIMACHAL ENERGY PRIVATE LIMITED,3694.0,IN0003592006
HIMACHAL PRADESH CRICKET ASSOCIATION,7999.0,IN0003588324
HIND ENERGY AND COAL BENEFICATION (INDIA) LIMITED,4911.0,IN0003604282
HIND MULTI SERVICES PRIVATE LIMITED,5199.0,IN0003604643
HINDCON CHEMICALS LIMITED,3999.0,IN621261FI
HINDUJA HOUSING FINANCE LIMITED,6141.0,IN0014357927
HINDUJA TECH LIMITED,7371.0,IN0002314859
HINDUSTAN COCA COLA HOLDINGS PRIVATE LIMITED,7389.0,IN0000211199
HINDUSTAN COCA-COLA BEVERAGES PRIVATE LIMITED,7389.0,IN0000211185
HINDUSTAN EQUIPMENTS PRIVATE LIMITED,134.0,IN0003606899
HINDUSTAN GLASS WORKS LIMITED,5085.0,IN0003691712
HINDUSTAN HYDRAULICS PVT LTD,2819.0,IN0001676294
HINDUSTAN OIL EXPLORATION COMPANY LIMITED,1311.0,IN30310FI
HINDUSTAN SHIPYARD LIMITED,7389.0,IN0000221209
HINO MOTORS SALES INDIA PRIVATE LIMITED,3711.0,IN0003689538
HIRA TECHNOLOGIES PRIVATE LIMITED,3631.0,IN0003689094
HITACHI ASTEMO CHENNAI PRIVATE LIMITED,3559.0,IN0013729177
HITECH PRINT SYSTEMS LIMITED,2851.0,IN0003617553
HITESH PLASTICS PRIVATE LIMITED,3089.0,IN0003618432
HK TOLL ROAD PRIVATE LIMITED,1611.0,IN0003619966
HL KLEMOVE INDIA PRIVATE LIMITED,3799.0,IN0015644141
HL MANDO ANAND INDIA PRIVATE LIMITED,5013.0,IN0015790893
HLE GLASCOAT LIMITED,2899.0,IN32914FI
HMSHOST SERVICES INDIA PRIVATE LIMITED,7389.0,IN0003585742
HODEK VIBRATION TECHNOLOGIES PRIVATE LIMITED,3511.0,IN0003622147
HOGANAS INDIA PRIVATE LIMITED,3312.0,IN0000242521
HOOGHLY MOTORS PRIVATE LIMITED,3711.0,IN0012347709
HORIZON POLYMER ENGINEERING PRIVATE LIMITED,2821.0,IN0009086103
HOYA MEDICAL INDIA PRIVATE LIMITED,5085.0,IN0009024329
HRS PROCESS SYSTEMS LIMITED,3412.0,IN0003627406
HTC GLOBAL SERVICES (INDIA) PRIVATE LIMITED,7375.0,IN0003633197
HURON EURASIA INDIA PRIVATE LIMITED,7371.0,IN0006666115
HYATT INDIA CONSULTANCY PRIVATE LIMITED,8742.0,IN0003680246
HYOSUNG CORPORATION INDIA PRIVATE LIMITED,5085.0,IN0003662148
HYTECH SEED INDIA PRIVATE LIMITED,7389.0,IN0003647036
HYUNDAI STEEL PIPE INDIA PRIVATE LIMITED,3312.0,IN0001243835
IAC ELECTRICALS PVT LTD,3612.0,IN0003647798
IAN MACLEOD DISTILLERS INDIA PRIVATE LIMITED,2033.0,IN0003648309
IBEX ENGINEERING PRIVATE LIMITED,3321.0,IN0003649297
ICA PIDILITE PRIVATE LIMITED,2834.0,IN0015445192
ICC REALTY (INDIA) PRIVATE LIMITED,1629.0,IN0003677229
ICE MAKE REFRIGERATION LIMITED,5078.0,IN496276FI
ICE MT INDIA PRIVATE LIMITED,7375.0,IN0005444635
ICE STEEL 1 PRIVATE LIMITED,3312.0,IN0001110943
IDFC FINANCIAL HOLDING COMPANY LIMITED,6159.0,IN0013602283
IGATPURI HIGHWAY PRIVATE LIMITED,1611.0,IN0000366828
IGP ENGINEERS PRIVATE LIMITED,1041.0,IN0003702546
IGT SOLUTIONS PRIVATE LIMITED,7374.0,IN0003893138
IGUS (INDIA) PRIVATE LIMITED,3562.0,IN0003702166
IIFL SAMASTA FINANCE LIMITED,6021.0,IN0013312213
IMPERIAL AUTO INDUSTRIES LIMITED,3711.0,IN0000222976
IMPETUS TECHNOLOGIES INDIA PRIVATE LIMITED,7375.0,IN0003713437
INABATA INDIA PRIVATE LIMITED,2257.0,IN0003735243
INCAP CONTRACT MANUFACTURING SERVICES PRIVATE LIMITED,7699.0,IN0003737378
INDAGRO FOODS PRIVATE LIMITED,2011.0,IN0000220981
INDEED INDIA OPERATIONS PRIVATE LIMITED,7375.0,IN0012372527
INDEGENE LIMITED,8099.0,IN110739FI
INDFRAG BIO SCIENCES PRIVATE LIMITED,711.0,IN0015504125
INDIA FACTORING AND FINANCE SOLUTIONS PRIVATE LIMITED,6019.0,IN0003751749
INDIA GAS SOLUTIONS PRIVATE LIMITED,4922.0,IN0003752234
INDIA LUXCO RETAIL PRIVATE LIMITED,5999.0,IN0013539694
INDIA STEEL SUMMIT PRIVATE LIMITED,3312.0,IN0003755768
INDIA TOURISM DEVELOPMENT CORPORATION LIMITED,7011.0,IN34662FI
INDIAN CLEARING CORPORATION LIMITED,6111.0,IN0003759925
INDIAN EXPRESS HOLDINGS AND ENTERPRISES PRIVATE LIMITED,6712.0,IN0004744035
INDIAN RAILWAY CATERING AND TOURISM CORPORATION LIMITED,7011.0,IN001577106IND
INDIAN SCHOOL OF BUSINESS,8211.0,IN0003766942
INDIAN TONERS & DEVELOPERS LTD,2893.0,IN31874FI
INDIAN WRITING INSTRUMENTS P LTD,3999.0,IN0003769139
INDIANOIL SKYTANKING PRIVATE LIMITED,1389.0,IN0000249331
INDIC EMS ELECTRONICS PRIVATE LIMITED,3672.0,IN0003770398
INDITEX TRENT RETAIL INDIA PRIVATE LIMITED,7389.0,IN0001583049
INDO TECH TRANSFORMERS LIMITED,4911.0,IN31592FI
INDRAPRASTHA GAS LIMITED,4932.0,IN30831FI
INDUCTIS (INDIA) PRIVATE LIMITED,7389.0,IN0003799551
INDUS COFFEE PRIVATE LIMITED,2051.0,IN0003801347
INDUS PETROCHEM LIMITED,2999.0,IN0003804518
INDUSTRIAL ASSET TRANSACTION SERVICES PRIVATE LIMITED,6531.0,IN0014309933
INFIBEAM AVENUES LIMITED,7372.0,IN117405FI
INFINEON TECHNOLOGIES INDIA PRIVATE LIMITED,8731.0,IN0003813568
INFO EDGE (INDIA) LTD,4899.0,IN33138FI
INFOBEANS TECHNOLOGIES LIMITED,7372.0,IN114054FI
INFOCEPTS TECHNOLOGIES PRIVATE LIMITED,7375.0,IN0003821217
INFORMATICA BUSINESS SOLUTIONS PRIVATE LIMITED,7371.0,IN0000211273
INFOSOFT DIGITAL DESIGN AND SERVICES PRIVATE LIMITED,3672.0,IN0003826616
INFOSTRETCH CORPORATION (INDIA) PRIVATE LIMITED,7371.0,IN0011813299
INGRAM MICRO INDIA SSC PRIVATE LIMITED,5199.0,IN0011701852
INNOVACCER ANALYTICS PRIVATE LIMITED,8742.0,IN0012057665
INNOVATION IMAGING TECHNOLOGIES PRIVATE LIMITED,3841.0,IN0015690446
INNOVATIVE RESINS PRIVATE LIMITED,2819.0,IN0003848816
INNVOLUTION HEALTHCARE PRIVATE LIMITED,5084.0,IN0003852398
INSPIRA BIO-PHARM PRIVATE LIMITED,2834.0,IN0003859814
INSPIRAGE SOFTWARE CONSULTING PRIVATE LIMITED,7375.0,IN0003860052
INTEGRA AUTOMATION PRIVATE LIMITED,3571.0,IN0003871717
INTERGLOBE TECHNOLOGY QUOTIENT PRIVATE LIMITED,7389.0,IN0003893143
INTERPUMP HYDRAULICS INDIA PRIVATE LIMITED,3612.0,IN0003900528
INTERRAIL INDIA PRIVATE LIMITED,4225.0,IN0014548239
INTEVA PRODUCTS INDIA AUTOMOTIVE PRIVATE LIMITED,3694.0,IN0000022683
INVENTURUS KNOWLEDGE SOLUTIONS LIMITED,7371.0,IN0003909167
INYANTRA TECHNOLOGIES PRIVATE LIMITED,7375.0,IN0003913303
IOPEX TECHNOLOGIES PRIVATE LIMITED,7371.0,IN0008051403
IQVIA ANALYTICS SERVICES PRIVATE LIMITED,8742.0,IN0007204402
IRB PATHANKOT AMRITSAR TOLL ROAD LIMITED,1611.0,IN0003918317
ISA LOGISTICS PRIVATE LIMITED,4491.0,IN0003919512
ISC PROJECTS PRIVATE LIMITED,1629.0,IN0014281405
ISHA SNACKS PRIVATE LIMITED,2051.0,IN0003922733
ISOVOLTA (INDIA) PVT LTD,2819.0,IN0003932588
ITALICA GRANITO PRIVATE LIMITED,3299.0,IN0016154942
ITOCHU INDIA PRIVATE LIMITED,5085.0,IN0003941192
IV COUNTY PRIVATE LIMITED,6531.0,IN0003946947
J THOMAS & CO PVT LTD,5085.0,IN0009367486
J. P. MORGAN SERVICES INDIA PRIVATE LIMITED,7375.0,IN0009708394
J.C. FLOWERS ASSET RECONSTRUCTION PRIVATE LIMITED,7389.0,IN0014824352
J.C. INFRA CORPORATION LIMITED,1611.0,IN0009773833
J.R SPECIALITY CHEMICALS PRIVATE LIMITED,2819.0,IN0009728347
JADE BLUE LIFESTYLE INDIA LIMITED,2281.0,IN0003956394
JAGUAR LAND ROVER INDIA LIMITED,3711.0,IN0007998092
JAHNVI MOTOR PRIVATE LIMITED,5012.0,IN0004019479
JAI AND SONS PRIVATE LIMITED,5013.0,IN0015137558
JAI BALAJI INDUSTRIES LIMITED,3462.0,IN32012FI
JAI DURGA MULTI-TRADE PRIVATE LIMITED,5199.0,IN0004024722
JAI HIND SUGAR PRIVATE LIMITED,5141.0,IN0003959755
JAIN VINIMAY PRIVATE LIMITED,5051.0,IN0003982929
JAINEX PARIWAHAN PRIVATE LIMITED,5199.0,IN0003984884
JAIPRAKASH POWER VENTURES LIMITED,4911.0,IN31376FI
JAIPUR RATNA MANUFACTURING PRIVATE LIMITED,3911.0,IN0007998429
JAKSONS DEVELOPERS PRIVATE LIMITED,1629.0,IN0003998376
JAMNA AUTO INDUSTRIES LIMITED,5015.0,IN32034FI
JAMNA DASS NIKKA MAL JAIN SARAF PVT LTD,3911.0,IN0004035596
JAMSHEDPUR CHLOROCHEM PRIVATE LIMITED,2851.0,IN0004036715
JANKI COKES TRADERS PRIVATE LIMITED,5085.0,IN0004048765
JARO INSTITUTE OF TECHNOLOGY MANAGEMENT AND RESEARCH LIMITED,8221.0,IN0004056122
JAY BEE LAMINATIONS LIMITED,2789.0,IN0004073597
JAY JAGDAMBA LIMITED,3312.0,IN0011670193
JAY SWITCHES (INDIA) PRIVATE LIMITED,7389.0,IN0004080182
JAYALAKSHMI SILKS PVT LTD,5999.0,IN0004085094
JAYESH INDUSTRIES LIMITED,7389.0,IN0004094401
JAYPEE BROTHERS MEDICAL PUBLISHERS PRIVATE LIMITED,7389.0,IN0004097415
JAYPEE CAPITAL SERVICES LIMITED,7389.0,IN0004097453
JCB POWER PRODUCTS INDIA PRIVATE LIMITED,3612.0,IN0013518888
JECON ENGINEERS PRIVATE LIMITED,8742.0,IN0004105978
JEEVANDEEP EDUMEDIA PRIVATE LIMITED,3571.0,IN0004112558
JEFFERIES INDIA PRIVATE LIMITED,8742.0,IN0004114665
JEYACHANDRAN INDUSTRIES PRIVATE LIMITED,2269.0,IN0004121727
JFE ENGINEERING INDIA PRIVATE LIMITED,8711.0,IN0004122606
JFE SHOJI INDIA PRIVATE LIMITED,3321.0,IN0020487019
JFROG INDIA PRIVATE LIMITED,7375.0,IN0016839133
JHAJJAR POWER LIMITED,4911.0,IN0000025125
JINDAL COKE LIMITED,2999.0,IN0013863471
JINDAL POLY INVESTMENT AND FINANCE COMPANY LTD,6099.0,IN37244FI
JINDAL POWER LIMITED,4911.0,IN0000212268
JINDAL RAIL INFRASTRUCTURE LIMITED,1799.0,IN0004138219
JINDAL SAW LIMITED,3399.0,IN30150FI
JINKUSHAL INDUSTRIES PRIVATE LIMITED,5199.0,IN0004140756
JITENDRA MOTORS PRIVATE LIMITED,5085.0,IN0004143288
JITF INFRALOGISTICS LIMITED,4789.0,IN102025FI
JITF URBAN INFRASTRUCTURE LIMITED,6531.0,IN0000341096
JITF URBAN INFRASTRUCTURE SERVICES LIMITED,4939.0,IN0004143602
JK PAPER LIMITED,2631.0,IN30918FI
JKT ENTERPRISES PRIVATE LIMITED,5085.0,IN0004151058
JLC ELECTROMET PRIVATE LIMITED,3312.0,IN0004151823
JOBBY ENGINEERS PRIVATE LIMITED,3398.0,IN0004183261
JOHARI DIGITAL HEALTHCARE LIMITED,1629.0,IN0004179486
JOHNSON & JOHNSON SURGICAL VISION INDIA PRIVATE LIMITED,2834.0,IN0000398461
JOHNSON CONTROLS (INDIA) PRIVATE LIMITED,3812.0,IN0004178282
JOLLY BOARD LIMITED,2435.0,IN0000239138
JOST INDIA AUTO COMPONENT PRIVATE LIMITED,3799.0,IN0004169543
JOST'S ENGINEERING COMPANY LIMITED,8711.0,IN31925FI
JOYALUKKAS INDIA LIMITED,5021.0,IN0004163367
JP STRUCTURES PRIVATE LIMITED,1629.0,IN0009782807
JSG INNOTECH PRIVATE LIMITED,3694.0,IN0007792725
JSS EDUCATION FOUNDATION PRIVATE LIMITED,8221.0,IN0007789829
JSW DHARAMTAR PORT PRIVATE LIMITED,7261.0,IN0007789143
JSW ENERGY LIMITED,4911.0,IN34008FI
JSW INFRASTRUCTURE LIMITED,4499.0,IN116568FI
JSW JAIGARH PORT LIMITED,1623.0,IN0007789093
JSW SEVERFIELD STRUCTURES LIMITED,3441.0,IN0007788917
JTL INDUSTRIES LTD,3317.0,IN34593FI
JUHU BEACH RESORTS LIMITED,5812.0,IN0000232454
JUNIPER GREEN ENERGY PRIVATE LIMITED,4911.0,IN0001228255
JUST-IN-TIME TRADING PRIVATE LIMITED,5085.0,IN0004187952
JVS COMATSCO INDUSTRIES PRIVATE LIMITED,7389.0,IN0004202682
JYOTI PLASTIC WORKS PRIVATE LIMITED,3089.0,IN0004209974
JYOTI RESINS & ADHESIVES LIMITED,2891.0,IN31827FI
JYOTI SOLUTIONSWORKS PRIVATE LIMITED,3462.0,IN0004209212
K BHUPAL ENGINEERS AND CONTRACTORS PRIVATE LIMITED,1799.0,IN0013984676
K.P. ENERGY LIMITED,4911.0,IN116746FI
K.P.I. GLOBAL INFRASTRUCTURE LIMITED,4911.0,IN001576262IND
K.P.MANISH GLOBAL INGREDIENTS PRIVATE LIMITED,5021.0,IN0010913843
KA HOSPITALITY PRIVATE LIMITED,7021.0,IN0004225547
KABRA EXTRUSIONTECHNIK LTD.,3999.0,IN31814FI
KACH MOTORS PRIVATE LIMITED,3312.0,IN0004221191
KAILASH VAHN PRIVATE LIMITED,3694.0,IN0004232336
KAKINADA INFRASTRUCTURE HOLDINGS PRIVATE LIMITED,6111.0,IN0004242422
KALAIGNAR TV PRIVATE LIMITED,7812.0,IN0004245488
KALIKA STEEL ALLOYS PRIVATE LIMITED,3312.0,IN0004254118
KALINGA COMMERCIAL CORPORATION LIMITED,1629.0,IN0004256569
KALPATARU RETAIL VENTURES PRIVATE LIMITED,1629.0,IN0004266971
KALYAN JEWELLERS INDIA LIMITED,3911.0,IN573482FI
KALYAN TOLL INFRASTRUCTURE LIMITED,1611.0,IN0004273931
KALYANI TRANSMISSION TECHNOLOGIES PRIVATE LIMITED,3542.0,IN0014709712
KAMAL ENCON INDUSTRIES LIMITED,7389.0,IN0004474984
KAMAT HOTELS (INDIA) LIMITED,7011.0,IN31543FI
