Name,SIC,BVD
JFROG INDIA PRIVATE LIMITED,7375.0,IN0016839133
JINKUSHAL INDUSTRIES PRIVATE LIMITED,5199.0,IN0004140756
JITF INFRALOGISTICS LIMITED,4789.0,IN102025FI
JITF URBAN INFRASTRUCTURE SERVICES LIMITED,4939.0,IN0004143602
JKS INDIA HOLDINGS LIMITED,6019.0,IN0004150754
JMS MINES & MINERALS PRIVATE LIMITED,1499.0,IN0013719735
JNB STEEL INDUSTRIES PRIVATE LIMITED,3312.0,IN0004159044
JODAS EXPOIM PRIVATE LIMITED,2834.0,IN0004182484
JOHARI DIGITAL HEALTHCARE LIMITED,1629.0,IN0004179486
JOHN CRANE SEALING SYSTEMS INDIA PRIVATE LIMITED,3999.0,IN0004160227
JOHNSON CONTROLS (INDIA) PRIVATE LIMITED,3812.0,IN0004178282
JONES LANG LASALLE PROPERTY CONSULTANTS (INDIA) PRIVATE LIMITED,8742.0,IN0004175574
JP INFRA REALTY PRIVATE LIMITED,1629.0,IN0005972085
JRD DENIMS LIMITED,2257.0,IN0016710671
JSW SEVERFIELD STRUCTURES LIMITED,3441.0,IN0007788917
JSW STRUCTURAL METAL DECKING LIMITED,3441.0,IN0007788815
JSW TECHNO PROJECTS MANAGEMENT LIMITED,7389.0,IN0007788872
JU AGRI SCIENCES PRIVATE LIMITED,7389.0,IN0009738345
JUBILANT BIOSYS LIMITED,2819.0,IN0000254514
JUBILEE PLOT & HOUSING PRIVATE LIMITED,1629.0,IN0004200941
K K GUPTA CONSTRUCTIONS PRIVATE LIMITED,1629.0,IN0009375795
K K SPINTEX INDIA PRIVATE LIMITED,2281.0,IN0005227087
K M JEWELLERS PRIVATE LIMITED,5051.0,IN0009388337
K PATEL PHYTO EXTRACTIONS PRIVATE LIMITED,2834.0,IN0009391938
K.P.I. GLOBAL INFRASTRUCTURE LIMITED,4911.0,IN001576262IND
K.P.MANISH GLOBAL INGREDIENTS PRIVATE LIMITED,5021.0,IN0010913843
K.RAHEJA IT PARK (HYDERABAD) LIMITED,1629.0,IN0010156918
K12 TECHNO SERVICES PRIVATE LIMITED,8211.0,IN0009249326
KAKINADA SEAPORTS LIMITED,2834.0,IN0000234746
KALEESUWARI REFINERY AND INDUSTRY PRIVATE LIMITED,2999.0,IN0010105734
KALINGA COMMERCIAL CORPORATION LIMITED,1629.0,IN0004256569
KALPATARU PROJECTS INTERNATIONAL LIMITED,4911.0,IN30629FI
KALPSUTRA CHEMICALS PRIVATE LIMITED,3211.0,IN0004269192
KALTHIA ENGINEERING AND CONSTRUCTION LIMITED,3569.0,IN0004271793
KALYANI ALLOY CASTINGS LTD,5051.0,IN0004274629
KAMAC ENGINEER'S PRIVATE LIMITED,8711.0,IN0004278648
KAMAL WATCH COMPANY PRIVATE LIMITED,2074.0,IN0004285368
KAMSONS POLYMERS PRIVATE LIMITED,2834.0,IN0011677516
KANAKADURGA AGRO OIL PRODUCTS PRIVATE LIMITED,2041.0,IN0000254293
KANDHARI BEVERAGES PRIVATE LIMITED,2084.0,IN0004312303
KANEKA INDIA PRIVATE LIMITED,3069.0,IN0004314058
KANJALOCHANA FINSERVE PRIVATE LIMITED,7389.0,IN0017480463
KANODIA GLOBAL PRIVATE LIMITED,2326.0,IN0004327139
KANOHAR ELECTRICALS LIMITED,3694.0,IN33996FI
KAPCO INTERNATIONAL LIMITED,7389.0,IN0004368494
KAPOOR INDUSTRIES LIMITED,2399.0,IN0004386554
KAPSTON FACILITIES MANAGEMENT LIMITED,7389.0,IN121081FI
KARNATAKA POWER CORPORATION LIMITED,8062.0,IN0000212838
KARNATAKA ROAD DEVELOPMENT CORPORATION LIMITED,1799.0,IN0000287453
KARZA TECHNOLOGIES PRIVATE LIMITED,8721.0,IN0015135539
KASTURI FOUNDRY PRIVATE LIMITED,3321.0,IN0004496904
KATALINE INFRA-PRODUCTS PRIVATE LIMITED,2851.0,IN0004499849
KATHERI INDUSTRIAL PRIVATE LIMITED,2281.0,IN0011142743
KAUVERY HOSPITAL MEDICAL SERVICES PRIVATE LIMITED,8062.0,IN0001090731
KAVURI HILLS DEVELOPERS PRIVATE LIMITED,1629.0,IN0004534853
KAY PEE EQUIPMENTS PVT LTD,3743.0,IN0004539352
KEERTANA FINSERV PRIVATE LIMITED,6021.0,IN0009905794
KEI INDUSTRIES LIMITED,3357.0,IN30982FI
KELLOGG BROWN & ROOT ENGINEERING & CONSTRUCTION INDIA PRIVATE LIMITED,8711.0,IN0004543535
KEN ENTERPRISES PRIVATE LIMITED,2299.0,IN0015001272
KENNAMETAL INDIA LIMITED,3541.0,IN30755FI
KERALA COMMUNICATORS CABLE LIMITED,7375.0,IN0004553051
KESHAVJI CHHAGANLAL JEWELLERS PRIVATE LIMITED,3911.0,IN0004615366
KESHO PACKAGING PRIVATE LIMITED,4783.0,IN0004560628
KETI SANGAM INFRASTRUCTURE (INDIA) LIMITED,1611.0,IN0004562609
KG PETROCHEM LTD,2299.0,IN32861FI
KHADIM DEVELOPMENT COMPANY PRIVATE LIMITED,6531.0,IN0004571956
KHARAGPUR METAL REFORMING INDUSTRIES PVT LTD,3312.0,IN0011532543
KHEMKA REFRACTORIES PRIVATE LIMITED,3241.0,IN0004598655
KHETAN VINIYOG PRIVATE LIMITED,3251.0,IN0004604335
KHFM HOSPITALITY & FACILITY MANAGEMENT SERVICES LTD,8059.0,IN001142806IND
KIMS HOSPITAL ENTERPRISES PRIVATE LIMITED,8011.0,IN0010901311
KINAXIS INDIA PRIVATE LIMITED,7375.0,IN0007343688
KIRLOSKAR PNEUMATIC COMPANY LIMITED,3563.0,IN31560FI
KISAN PHOSPHATES PRIVATE LIMITED,3281.0,IN0004626604
KISANKRAFT LIMITED,3542.0,IN0004627072
KISANMITRA WAREHOUSING PRIVATE LIMITED,7389.0,IN0004627091
KITEX GARMENTS LIMITED,2299.0,IN32471FI
KJ ISPAT LIMITED,3312.0,IN0004633844
KKV AGRO POWERS LIMITED,4911.0,IN116987FI
KLA-TENCOR SOFTWARE INDIA PRIVATE LIMITED,7371.0,IN0004648108
KLM LABORATORIES PRIVATE LIMITED,2834.0,IN0004637566
KMC SPECIALITY HOSPITALS INDIA LIMITED,8062.0,IN32310FI
KNOWN-YOU SEED (INDIA) PRIVATE LIMITED,173.0,IN0008072719
KOHINOOR ROPES PRIVATE LIMITED,3069.0,IN0014924153
KOKUYO RIDDHI PAPER PRODUCTS PRIVATE LIMITED,2655.0,IN0014771628
KOMAL WORLDWIDE PRIVATE LIMITED,2299.0,IN0016453378
KONTACT CONSORTIUM INDIA PRIVATE LIMITED,3648.0,IN0004677294
KOTAK MAHINDRA TRUSTEE COMPANY LIMITED,6159.0,IN0000282092
KPMG GLOBAL SERVICES PRIVATE LIMITED,8742.0,IN0004698558
KPMG RESOURCE CENTRE PRIVATE LIMITED,8742.0,IN0004698613
KRISHNA BELTS PRIVATE LIMITED,3069.0,IN0004716858
KRISHNA INSTITUTE OF MEDICAL SCIENCES LIMITED,8099.0,IN001758270IND
KRISHNA LANDI RENZO INDIA PRIVATE LIMITED,7538.0,IN0008654152
KRISHNA PROMOTIONS PRIVATE LIMITED,5093.0,IN0004725058
KRISHNAVENI CARBON PRODUCTS PRIVATE LIMITED,3321.0,IN0004731208
KRONOS SOLUTIONS INDIA PRIVATE LIMITED,3571.0,IN0004753014
KRYSTAL FAMILY HOLDINGS PRIVATE LIMITED,7389.0,IN0016498379
KSB LIMITED,3561.0,IN30621FI
KSOLARE ENERGY PRIVATE LIMITED,4911.0,IN0007652835
KUMAR ORGANIC PRODUCTS LIMITED,8062.0,IN0007708048
KUMAR SPINTEX PRIVATE LIMITED,2299.0,IN0007708865
KUNDAN CRAFT PRIVATE LIMITED,5085.0,IN0007716794
KUNDUR CONSTRUCTIONS PRIVATE LIMITED,8711.0,IN0007718951
KUNNATHAN CHIP BOARDS PRIVATE LIMITED,2499.0,IN0007720894
KUSUM HEALTHCARE PRIVATE LIMITED,6019.0,IN0008065002
KWALITY CHEMICAL INDUSTRIES PRIVATE LIMITED,2819.0,IN0007730493
L&E INDIA PRIVATE LIMITED,3711.0,IN0009498174
L&T ENERGY HYDROCARBON ENGINEERING LIMITED,8711.0,IN0000245832
L&T SAMAKHIALI GANDHIDHAM TOLLWAY LIMITED,1611.0,IN0009498592
L&T THALES TECHNOLOGY SERVICES PRIVATE LIMITED,7371.0,IN0005618911
L.S. POWER CONTROL PRIVATE LIMITED,3691.0,IN0012318345
LAKSHMI INFRASTRUCTURE & DEVELOPERS INDIA PRIVATE LIMITED,1799.0,IN0013883823
LALCHND JEWELLERS PRIVATE LIMITED,3911.0,IN0010722106
LAMINAAR AVIATION INFOTECH (INDIA) PRIVATE LIMITED,3571.0,IN0000296738
LAPP INDIA PRIVATE LIMITED,3499.0,IN0010143044
LARK LABORATORIES (INDIA) LTD,2834.0,IN0010671304
LAULS PRIVATE LIMITED,5085.0,IN0010125573
LAURUS LABS LIMITED,2834.0,IN38049FI
LAVISH GRANITO PRIVATE LIMITED,3251.0,IN0012483281
LCM LOGISTICS PRIVATE LIMITED,4789.0,IN0015072604
LEARNING MATE SOLUTIONS PRIVATE LIMITED,7375.0,IN0007479566
LEASE PLAN INDIA PRIVATE LIMITED,7389.0,IN0007479789
LEE PHARMA LIMITED,2834.0,IN0007481336
LEEFORD HEALTHCARE LIMITED,2834.0,IN0008044077
LEGACY COMMODITIES PRIVATE LIMITED,5085.0,IN0014967204
LEGEND CARS PRIVATE LIMITED,5012.0,IN0008042006
LENDINGKART TECHNOLOGIES PRIVATE LIMITED,7375.0,IN0013934903
LIEBHERR INDIA PRIVATE LIMITED,5085.0,IN0000021904
LIGHT MICROFINANCE PRIVATE LIMITED,6111.0,IN0008012366
LIKHITHA INFRASTRUCTURE LIMITED,1623.0,IN138597FI
LINDE ENGINEERING INDIA PRIVATE LIMITED,4899.0,IN0006612933
LINTL CLOTHING PRIVATE LIMITED,2326.0,IN0008191642
LITMUS7 SYSTEMS CONSULTING PRIVATE LIMITED,7371.0,IN0008226002
LLOYD SHOES INDIA PRIVATE LIMITED,3111.0,IN0007504909
LM WIND POWER BLADES (INDIA) PRIVATE LIMITED,3612.0,IN0007505501
LOGENIX SERVICES PRIVATE LIMITED,5199.0,IN0015458496
LOGISTICS PLUS INDIA PRIVATE LIMITED,4789.0,IN0014216712
LOGITECH ENGINEERING & DESIGNS INDIA PRIVATE LIMITED,7375.0,IN0000401326
LONGWELL INVESTMENT PRIVATE LIMITED,6111.0,IN0008358884
LORVEN FLEX AND SACK INDIA PRIVATE LIMITED,3559.0,IN0013212839
LOTUS TRADING AND SECURITIES PRIVATE LIMITED,3694.0,IN0008103295
LOUIS VUITTON INDIA RETAIL PRIVATE LIMITED,5085.0,IN0012611012
LOWE'S SERVICES INDIA PRIVATE LIMITED,7374.0,IN0013225011
LSL TOOLS PRIVATE LIMITED,3441.0,IN0005511832
LUBRIZOL ADVANCED MATERIALS INDIA PRIVATE LIMITED,2299.0,IN0008367946
LUCID MEDICAL DIAGNOSTICS PRIVATE LIMITED,2834.0,IN0013238576
LUKER ELECTRIC TECHNOLOGIES PRIVATE LIMITED,3694.0,IN0014322209
LUMINAZ SAFETY GLASS PRIVATE LIMITED,3711.0,IN0012401932
LUNIA MARKETING PRIVATE LIMITED,5199.0,IN0007543364
LUSTER GOLD PALACE (INDIA) PRIVATE LIMITED,5999.0,IN0007544433
LUX INDUSTRIES LIMITED,2259.0,IN111027FI
LYRA NETWORK PRIVATE LIMITED,7375.0,IN0007549243
M AND C PROPERTY DEVELOPMENT PRIVATE LIMITED,6512.0,IN0009131166
M B SUGARS AND PHARMACEUTICALS PRIVATE LIMITED,2061.0,IN0009133012
M N AUTO PRODUCTS PRIVATE LIMITED,5013.0,IN0009143558
M P STEEL (INDIA) PRIVATE LIMITED,3499.0,IN0009760918
M PALLONJI SHIPPING PVT LTD,4499.0,IN0009145651
M R T SIGNALS LIMITED,4173.0,IN0009148252
M. G. BAKERS PRIVATE LIMITED,2051.0,IN0013186482
MAC-CHEM PRODUCTS (INDIA) PRIVATE LIMITED,2834.0,IN0007576139
MACHBIZZ MARKETERS PRIVATE LIMITED,7375.0,IN0012284099
MACO CORPORATION (INDIA) PRIVATE LIMITED,3531.0,IN0004762287
MACQUARIE GLOBAL SERVICES PRIVATE LIMITED,7299.0,IN0007582142
MADDOCK FILMS PRIVATE LIMITED,8721.0,IN0011385156
MADHAV UDYOG PRIVATE LIMITED,3312.0,IN0010796896
MADHEPURA ELECTRIC LOCOMOTIVE PRIVATE LIMITED,3799.0,IN0015217698
MADHULOKA LIQUOR BOUTIQUE PRIVATE LIMITED,5499.0,IN0013171999
MADHUR IRON & STEEL (INDIA) PRIVATE LIMITED,3441.0,IN0012724155
MADHYA BHARAT AGRO PRODUCTS LIMITED,1475.0,IN117174FI
MADISON COMMUNICATIONS PRIVATE LIMITED,7311.0,IN0010841715
MAERSK LINE INDIA PRIVATE LIMITED,4789.0,IN0011390408
MAGIC SOFTWARE PRIVATE LIMITED,7389.0,IN0010881495
MAGMA INDUSTRIES LIMITED,2873.0,IN0010667738
MAHADEV MOTORS PRIVATE LIMITED,5571.0,IN0012727763
MAHAKALESHWAR INFRATECH PRIVATE LIMITED,6531.0,IN0014397515
MAHALAXMI METALLOYS (INDIA) PRIVATE LIMITED,3321.0,IN0012767574
MAHARAJA RESOURCES PRIVATE LIMITED,5051.0,IN0011089404
MAHARASHTRA NATURAL GAS LIMITED,1311.0,IN0000281434
MAHASAI ALUMINIUM PROFILES PRIVATE LIMITED,1041.0,IN0013638229
MAHASHIAN DI HATTI PRIVATE LIMITED,2099.0,IN0010895802
MAHAVEER MEDI-SALES PRIVATE LIMITED,5199.0,IN0015731742
MAHENDRA HOMES PRIVATE LIMITED,6531.0,IN0012986547
MAHESH NAMKEEN PRIVATE LIMITED,2051.0,IN0010660669
MAHESHRAJ CHEMICALS PRIVATE LIMITED,2834.0,IN0010773212
MAHINDRA DEFENCE SYSTEMS LIMITED,9229.0,IN0014755205
MAITHRI LABORATORIES PRIVATE LIMITED,2834.0,IN0010145837
MAKEEN ENERGY INDIA PRIVATE LIMITED,2999.0,IN0013800227
MAKWELL PLASTISIZERS PRIVATE LIMITED,3089.0,IN0010945846
MALABAR JEWELS AND GEMS PRIVATE LIMITED,5021.0,IN0010659712
MALABAR KODUNGALLUR SONA BAZAR PRIVATE LIMITED,5999.0,IN0011186739
MALABAR ORNAMENTS PRIVATE LIMITED,5021.0,IN0010659401
MALABAR ROYAL DESIGNS (HYDERABAD) PRIVATE LIMITED,5999.0,IN0010668237
MALABAR RUBY PRIVATE LIMITED,5999.0,IN0011258245
MALKIT AGROTECH PRIVATE LIMITED,3569.0,IN0013019477
MANAPPURAM HOME FINANCE LIMITED,6019.0,IN0011396757
MANAS MERCHANDISE PRIVATE LIMITED,5085.0,IN0012569103
MANDA PROJECTS PRIVATE LIMITED,1629.0,IN0010807106
MANGE RAM ENTERPRISES PRIVATE LIMITED,5085.0,IN0013376485
MANHATTAN ASSOCIATES (INDIA) DEVELOPMENT CENTRE PRIVATE LIMITED,7371.0,IN0010669066
MANIPAL HOSPITALS (BENGALURU) PRIVATE LIMITED,8062.0,IN0005354934
MANISHRI REFRACTORIES AND CERAMICS PRIVATE LIMITED,3251.0,IN0010752287
MANITOU SOUTH ASIA PRIVATE LIMITED,3559.0,IN0012647499
MANKU AGROTECH PRIVATE LIMITED,3523.0,IN0010789174
MANNAKRISHNA INVESTMENTS PRIVATE LIMITED,6159.0,IN0010946326
MANPRO EQUIPMENTS PRIVATE LIMITED,3569.0,IN0013121485
MANSUKH SECURITIES AND FINANCE LIMITED,7389.0,IN0010698936
MANTENA INFRASOL PRIVATE LIMITED,4939.0,IN0012983984
MAPRA LABORATORIES PVT LTD,2819.0,IN0010861034
MARELLI MOTHERSON AUTOMOTIVE LIGHTING INDIA PRIVATE LIMITED,3694.0,IN0009236639
MARIAPPS MARINE SOLUTIONS PRIVATE LIMITED,7375.0,IN0001840843
MARKIT INDIA SERVICES PRIVATE LIMITED,7389.0,IN0013318747
MARKSANS PHARMA LIMITED,2834.0,IN30949FI
MARKSMEN MARINE PRODUCTS PRIVATE LIMITED,5999.0,IN0014352008
MARSH INDIA INSURANCE BROKERS PRIVATE LIMITED,6411.0,IN0000401034
MARUTI CLEAN COAL AND POWER LIMITED,2899.0,IN0010618364
MARWADI SHARES AND FINANCE LIMITED,6141.0,IN0010804923
MASYC PROJECTS PRIVATE LIMITED,7389.0,IN0010881652
MAVENIR SYSTEMS PRIVATE LIMITED,7376.0,IN0012827443
MAX ENGINEERING & MARKETING PRIVATE LIMITED,5085.0,IN0015693933
MAZDA LIMITED,8711.0,IN33509FI
MBMG DIAMONDS PRIVATE LIMITED,3911.0,IN0007589054
MECGALE PNEUMATICS PRIVATE LIMITED,7389.0,IN0007601057
MED MANOR ORGANICS PRIVATE LIMITED,2834.0,IN0008237762
MEDI ASSIST HEALTHCARE SERVICES LIMITED,9431.0,IN001862802IND
MEDLINE INDUSTRIES INDIA PRIVATE LIMITED,7389.0,IN0008253701
MEERA COTTON AND SYNTHETIC MILLS PRIVATE LIMITED,2269.0,IN0008261093
MEGAA MODA PRIVATE LIMITED,5199.0,IN0008269454
MEGASOLIS RENEWABLES PRIVATE LIMITED,4939.0,IN0011388365
MEGASTAR FOODS LIMITED,2041.0,IN719280FI
MEGATHERM INDUCTION LIMITED,3694.0,IN0008274053
MEGHMANI INDUSTRIES LIMITED,3569.0,IN0000235492
MEKONG SILK MILLS PRIVATE LIMITED,2281.0,IN0015979383
MEL TRAINING & ASSESSMENTS LIMITED,7389.0,IN0001276648
MENAKA MILLS PRIVATE LIMITED,3571.0,IN0008301123
MERCEDES-BENZ RESEARCH AND DEVELOPMENT INDIA PRIVATE LIMITED,8743.0,IN0008307415
MERCK PERFORMANCE MATERIALS PRIVATE LIMITED,5085.0,IN0000401307
MERCURY INDUSTRIES LIMITED,2834.0,IN0008310306
MERIDIAN MEDICAL RESEARCH & HOSPITAL LTD,8062.0,IN0000277301
MERIDIUM SERVICES AND LABS PRIVATE LIMITED,7375.0,IN0008314693
MERIL HEALTHCARE PRIVATE LIMITED,8099.0,IN0008314831
MERIL LIFE SCIENCES INDIA PRIVATE LIMITED,3841.0,IN0008314999
MERIL LIFE SCIENCES PRIVATE LIMITED,2834.0,IN0008315009
MERITUS INTELYTICS PRIVATE LIMITED,8299.0,IN0008317261
MERO ASIA PACIFIC ENGINEERING PRIVATE LIMITED,3441.0,IN0008319363
METHODS (INDIA) PRIVATE LIMITED,3559.0,IN0008333701
METROPOLE VINIMAY PRIVATE LIMITED,5085.0,IN0008342784
MFAR HOLDINGS PRIVATE LIMITED,6512.0,IN0009135323
MFB GEOTECH PRIVATE LIMITED,7389.0,IN0015728452
MI INDUSTRIES (INDIA) PRIVATE LIMITED,2399.0,IN0007604214
MICRON INSTRUMENTS PRIVATE LIMITED,3482.0,IN0010942739
MICRONOVA IMPEX PRIVATE LIMITED,5085.0,IN0004927496
MICROSOFT CORPORATION (INDIA) PVT LTD,7371.0,IN0010899854
MIDDLEBY INDIA ENGINEERING PRIVATE LIMITED,3531.0,IN0014009611
MILESTONE BUILDCON PRIVATE LIMITED,1629.0,IN0010699765
MILLENNIA REALTORS PRIVATE LIMITED,8062.0,IN0010803835
MILLIMAN INDIA PRIVATE LIMITED,8742.0,IN0010767893
MINDA SILCA ENGINEERING PRIVATE LIMITED,3694.0,IN0000022037
MINDRAY MEDICAL INDIA PVT. LTD,5199.0,IN0011347243
MINDSPRINT DIGITAL (INDIA) PRIVATE LIMITED,7371.0,IN0006874292
MINDTICKLE INTERACTIVE MEDIA PRIVATE LIMITED,7375.0,IN0014676359
MINSOL LIMITED,1041.0,IN111030FI
MIRACLE PRINT PACK PRIVATE LIMITED,4783.0,IN0012599436
MIRAJ ENTERTAINMENT LIMITED,7812.0,IN0012554974
MIS SUPPORT CENTER PRIVATE LIMITED,8721.0,IN0015234015
MITRA S K PVT LTD,5085.0,IN0010630894
MITSU CHEM PLAST LTD,3544.0,IN117335FI
MOBILEUM TECHNOLOGIES PRIVATE LIMITED,7389.0,IN0006723416
MODERN ROAD MAKERS P LTD,1611.0,IN0007639913
MODERN VEER RAYS SECURITY FORCE (INDIA) PVT LTD,7382.0,IN0008379944
MODI HITECH INDIA LIMITED,5199.0,IN0008442153
MODICARE LIMITED,7371.0,IN0000255153
MODY CHEMI PHARMA LIMITED,2819.0,IN0020486475
MOLKEM CHEMICALS PRIVATE LIMITED,5085.0,IN0012383373
MONGODB SOFTWARE INDIA PRIVATE LIMITED,7374.0,IN0012061765
MONTECARLO LIMITED,4939.0,IN0008424297
MOPED HOUSE PRIVATE LIMITED,5012.0,IN0008437744
MORNINGSTAR INDIA PRIVATE LIMITED,7374.0,IN0011746231
MOTHER LAND TEXTILE INDIA PRIVATE LIMITED,2281.0,IN0008450911
MOTILAL OSWAL FINVEST LIMITED,6021.0,IN0000340906
MOTUL INDIA PRIVATE LIMITED,2999.0,IN0001233355
MOUNT ROOFING AND STRUCTURES PRIVATE LIMITED,3499.0,IN0016113891
MOUNTAIN VALLEY SPRINGS INDIA PRIVATE LIMITED,2841.0,IN0008461728
MOUSER ELECTRONICS (INDIA) PRIVATE LIMITED,3559.0,IN0013552096
MRF CORP LIMITED,6019.0,IN0000355747
MRG HOSPITALITY & INFRASTRUCTURE PRIVATE LIMITED,1629.0,IN0008471002
MSC TECHNOLOGY (INDIA) PRIVATE LIMITED,7375.0,IN0003650136
MSG GLOBAL SOLUTIONS INDIA PRIVATE LIMITED,7371.0,IN0007644749
MSKH SEATING SYSTEMS INDIA PRIVATE LIMITED,3631.0,IN0007645906
MSN LABORATORIES PRIVATE LIMITED,2834.0,IN0012666609
MSN ORGANICS PRIVATE LIMITED,2819.0,IN0007646875
MSP RETAIL PRIVATE LIMITED,5962.0,IN0007647393
MTAR TECHNOLOGIES LIMITED,3559.0,IN37278FI
MUKESH FURNISHINGS PRIVATE LIMITED,2399.0,IN0007667569
MUKKA PROTEINS LIMITED,912.0,IN0007669225
MUKUND CORRUPACK PRIVATE LIMITED,7389.0,IN0016391393
MULTI COMMODITY EXCHANGE CLEARING CORPORATION LIMITED,7389.0,IN0007677047
MULTI COMMODITY EXCHANGE OF INDIA LTD,6231.0,IN34627FI
MULTIPLES ALTERNATE ASSET MANAGEMENT PRIVATE LIMITED,7389.0,IN0007684273
MULTITECH AUTO PRIVATE LIMITED,3711.0,IN0007686254
MULTITEX FILTRATION ENGINEERS LIMITED,7389.0,IN0000215411
MUMBAI WASTE MANAGEMENT LIMITED,4953.0,IN0013160206
MURLI KRISHNA PHARMA PRIVATE LIMITED,2834.0,IN0008490109
MY HOME INFRASTRUCTURES PRIVATE LIMITED,1629.0,IN0007688579
MZ FOOD PRODUCTS PRIVATE LIMITED,2099.0,IN0007693024
N R C INDUSTRIES LIMITED,5085.0,IN0009161091
N. J. ECO-BUILD PRIVATE LIMITED,1629.0,IN0013278271
N. N. GLOBAL MERCANTILE PRIVATE LIMITED,7389.0,IN0011358602
NABROS TRANSPORT PVT LTD,912.0,IN0008748684
NABSAMRUDDHI FINANCE LIMITED,6141.0,IN0000628202
NAMDEV FINVEST PRIVATE LIMITED,6141.0,IN0008781721
NANDA INFRA CONSTRUCTION PRIVATE LIMITED,1629.0,IN0008790227
NANDAN TERRY LIMITED,2257.0,IN0014839879
NANDI ECONOMIC CORRIDOR ENTERPRISES LIMITED,8062.0,IN0008794785
NARAYANA HRUDAYALAYA LIMITED,5047.0,IN117411FI
NARBADA GEMS AND JEWELLERY LIMITED,3911.0,IN33024FI
NARMADA BIO-CHEM LIMITED,2879.0,IN0008819342
NARSINGH MERCANTILE PRIVATE LIMITED,5085.0,IN0008824299
NASHER MILES PRIVATE LIMITED,5085.0,IN0011305275
NATH BIO-GENES (INDIA) LTD,139.0,IN72853FI
NATH INDUSTRIES LTD,2679.0,IN31828FI
NATIONAL HIGHWAYS & INFRASTRUCTURE DEVELOPMENT CORPORATION LIMITED,1799.0,IN0012218038
NATIONAL INVESTMENT AND INFRASTRUCTURE FUND LIMITED,7389.0,IN0015257248
NATIONAL PLASTIC TECHNOLOGIES LTD.,3089.0,IN31417FI
NATIONAL REALTY PRIVATE LIMITED,6512.0,IN0008838399
NAVKAR CORPORATION LIMITED,4789.0,IN36480FI
NCR CORPORATION INDIA PRIVATE LIMITED,7371.0,IN0000396404
NEBULA SURGICAL PRIVATE LIMITED,2834.0,IN0008872284
NEEYAMO ENTERPRISE SOLUTIONS PRIVATE LIMITED,7371.0,IN0008885313
NEOGEN CHEMICALS LIMITED,2869.0,IN001576439IND
NEPTUNE INFOSOLUTIONS PRIVATE LIMITED,3571.0,IN0000396729
NESCO LIMITED,1541.0,IN33537FI
NESTLE INDIA LIMITED,2099.0,IN30304FI
NETAJI OIL DEPOT PRIVATE LIMITED,8742.0,IN0019928817
NETCRACKER TECHNOLOGY SOLUTIONS (INDIA) PRIVATE LIMITED,8711.0,IN0009053615
NETENRICH TECHNOLOGIES PRIVATE LIMITED,7371.0,IN0010105651
NETMAGIC SOLUTIONS PRIVATE LIMITED,7371.0,IN0008890636
NEUDESIC TECHNOLOGIES PRIVATE LIMITED,7375.0,IN0008892738
NEULAND LABORATORIES LIMITED,2834.0,IN33539FI
NEUTRON SUNRAY PRIVATE LIMITED,4911.0,IN0016408175
NEVANSH BUSINESS SUPPORT SERVICES PRIVATE LIMITED,7389.0,IN0016925252
NEW OPPORTUNITY CONSULTANCY PRIVATE LIMITED,7261.0,IN0011967591
NEW PANDIAN TRAVELS PRIVATE LIMITED,4724.0,IN0013384203
NEWA INVESTMENTS PRIVATE LIMITED,6159.0,IN0009115764
NEWONE CONSTRUCTIONS PRIVATE LIMITED,1629.0,IN0009119308
NEXTGEN HEALTHCARE INDIA PRIVATE LIMITED,8099.0,IN0006882511
NEXUS CROP SCIENCE PRIVATE LIMITED,2873.0,IN0013414009
NHAVA SHEVA (INDIA) GATEWAY TERMINAL PRIVATE LIMITED,4789.0,IN0013818987
NICDC LOGISTICS DATA SERVICES LIMITED,7389.0,IN0020419604
NICO ORGO MARKETING PRIVATE LIMITED,751.0,IN0007384915
NIFTY LABS PRIVATE LIMITED,2834.0,IN0013661864
NIHON KOHDEN INDIA PRIVATE LIMITED,3841.0,IN0003966791
NILA INFRASTRUCTURES LIMITED,5039.0,IN33529FI
NIMBUS HARBOR FACILITIES MANAGEMENT PRIVATE LIMITED,8742.0,IN0010074887
NIPHA EXPORTS PRIVATE LIMITED,5085.0,IN0009979801
NIPPON KOEI INDIA PRIVATE LIMITED,7389.0,IN0012794698
NIPPON STEEL INDIA PRIVATE LIMITED,3499.0,IN0007407923
NIPRO INDIA CORPORATION PRIVATE LIMITED,3841.0,IN0014658836
NIRMAL POLY PLAST PRIVATE LIMITED,3089.0,IN0007413847
NISOL MANUFACTURING COMPANY PRIVATE LIMITED,2111.0,IN0012736668
NISSAN TRADING INDIA PRIVATE LIMITED,7538.0,IN0007425033
NIYATI ENGINEERING PRIVATE LIMITED,8711.0,IN0007441019
NLB SERVICES PRIVATE LIMITED,7375.0,IN0008856236
NOBEL HYGIENE PRIVATE LIMITED,2834.0,IN0012822666
NOBLE ALCHEM PRIVATE LIMITED,7389.0,IN0008740335
NOIDA POWER COMPANY LIMITED,3612.0,IN0000225924
NOKEN VITRIFIED PRIVATE LIMITED,3251.0,IN0015702442
NORISYS TECHNOLOGY PRIVATE LIMITED,3612.0,IN0007457259
NORTECH FERRO ALLOYS PRIVATE LIMITED,3711.0,IN0008734907
NORTHERN SPIRITS LIMITED,5182.0,IN744043FI
NOV INDIA PRIVATE LIMITED,3569.0,IN0001248956
NOVA AGRI SCIENCES PRIVATE LIMITED,711.0,IN0013212704
NOVARTIS HEALTHCARE PRIVATE LIMITED,2834.0,IN0000396698
NOVO NORDISK SERVICE CENTRE (INDIA) PRIVATE LIMITED,7389.0,IN0007453993
NOVOZYMES SOUTH ASIA PRIVATE LIMITED,2299.0,IN0007454537
NRP PROJECTS PRIVATE LIMITED,1629.0,IN0007476483
NRSS XXIX TRANSMISSION LIMITED,4911.0,IN0013510803
NRVS STEELS LIMITED,3312.0,IN0005893567
NTC ENGINEERING SERVICES PRIVATE LIMITED,6019.0,IN0007479464
NTC LOGISTICS INDIA PRIVATE LIMITED,4789.0,IN0007460991
NTS TECHNOLOGY SERVICES PRIVATE LIMITED,7375.0,IN0016114677
NTT COMMUNICATIONS INDIA NETWORK SERVICES PRIVATE LIMITED,4899.0,IN0014406354
NTT GLOBAL DATA CENTERS & CLOUD INFRASTRUCTURE INDIA PRIVATE LIMITED,7375.0,IN0008890591
NU HOSPITALS PRIVATE LIMITED,8062.0,IN0008730323
NUANCE INDIA PRIVATE LIMITED,4899.0,IN0008729693
NUBERG ENGINEERING LIMITED,8711.0,IN0004987315
NURECA LIMITED,8099.0,IN001415819IND
NUVAMA CLEARING SERVICES LIMITED,5199.0,IN0000310385
NV PROJECTS PRIVATE LIMITED,6512.0,IN0008723515
NVIDIA GRAPHICS PRIVATE LIMITED,3672.0,IN0001352546
NXTRA DATA LIMITED,7371.0,IN0015292983
OAK INFRASTRUCTURE DEVELOPERS LIMITED,6512.0,IN0008136298
OAKNORTH GLOBAL PRIVATE LIMITED,7371.0,IN0014220586
OCEAN CAPITAL MARKET LTD,6159.0,IN0000329072
OCEAN CONSTRUCTIONS (INDIA) PRIVATE LIMITED,1311.0,IN0007205867
OCROLUS EAST PRIVATE LIMITED,7375.0,IN0015524306
ODISHA POWER GENERATION CORPORATION LIMITED,4911.0,IN0000225938
ODISHA TELEVISION LIMITED,7389.0,IN0007253921
OIL FIELD WAREHOUSE & SERVICES PRIVATE LIMITED,4225.0,IN0007246246
OIL INDIA LIMITED,1311.0,IN33941FI
OM GLASS WORKS PRIVATE LIMITED,3269.0,IN0006865845
OMIDYAR NETWORK INDIA ADVISORS PRIVATE LIMITED,7299.0,IN0006816433
ONE INTERNATIONAL CENTER PRIVATE LIMITED,6531.0,IN0003757578
ONEIRO LIFECARE PRIVATE LIMITED,2834.0,IN0010020822
OPEN TEXT TECHNOLOGIES INDIA PRIVATE LIMITED,7371.0,IN0013559165
OPERATIVE INDIA PRIVATE LIMITED,7311.0,IN0008554707
ORACLE CERNER HEALTHCARE SOLUTIONS INDIA PRIVATE LIMITED,7371.0,IN0013903413
ORANGE CITY WATER PRIVATE LIMITED,4941.0,IN0008564085
ORANGE RETAIL FINANCE INDIA PRIVATE LIMITED,6021.0,IN0001300134
ORCH LABORATORIES INDIA PRIVATE LIMITED,2834.0,IN0013281663
ORGANICA AROMATICS PRIVATE LIMITED,2841.0,IN0008576931
ORIENT ELECTRIC LIMITED,3699.0,IN001576318IND
ORIENT STEEL & INDUSTRIES LIMITED,3312.0,IN30231FI
ORIENTAL CRAFTS MANUFACTURING COMPANY PRIVATE LIMITED,2499.0,IN0008092335
ORIENTAL FOUNDRY PRIVATE LIMITED,3321.0,IN0012260961
ORIENTAL STRUCTURAL ENGINEERS PRIVATE LIMITED,8711.0,IN0008582525
ORIGO COMMODITIES INDIA PRIVATE LIMITED,5199.0,IN0008584271
ORISSA METALIKS PRIVATE LIMITED,3312.0,IN0008087774
ORITO POLYFAB PRIVATE LIMITED,2299.0,IN0013413168
ORTHO CLINICAL DIAGNOSTICS INDIA PRIVATE LIMITED,5021.0,IN0014344535
OSE HUNGUND HOSPET HIGHWAYS PRIVATE LIMITED,1629.0,IN0000364308
OSI SYSTEMS PRIVATE LIMITED,7375.0,IN0012813704
OSIA HYPER RETAIL LIMITED,5999.0,IN544855FI
OSTWAL PHOSCHEM (INDIA) LIMITED,3251.0,IN0000275942
OSWAL INDUSTRIES LIMITED,3312.0,IN0000247915
OT PRIVACY SOFTWARE PRIVATE LIMITED,7375.0,IN0017662352
OTIS GLOBAL SERVICES CENTER PRIVATE LIMITED,7389.0,IN0016923437
OUTSHINY INDIA PRIVATE LIMITED,3161.0,IN0012359434
OXANE PARTNERS INDIA PRIVATE LIMITED,8742.0,IN0012182284
P D NAVKAR BIO CHEM PRIVATE LIMITED,2819.0,IN0009169568
P.P.KHARPATIL CONSTRUCTIONS PRIVATE LIMITED,1611.0,IN0010089282
PACE PACKAGING MACHINES PRIVATE LIMITED,3559.0,IN0006905153
PACIFIC BPO PRIVATE LIMITED,7375.0,IN0006907203
PAGODA STEELS PRIVATE LIMITED,5199.0,IN0007044993
PAGRO FROZEN FOODS PRIVATE LIMITED,2033.0,IN0007045138
PAI INTERNATIONAL ELECTRONICS LIMITED,5085.0,IN0007020216
PALL INDIA PRIVATE LIMITED,3841.0,IN0007032836
PALO ALTO NETWORKS (INDIA) PRIVATE LIMITED,8721.0,IN0012241191
PALO ALTO NETWORKS (INDIA) TECHNOLOGIES PRIVATE LIMITED,7389.0,IN0015534439
PANIPAT ELEVATED CORRIDOR LIMITED,1611.0,IN0000261545
PAPER VANTAGE POINT PRIVATE LIMITED,5199.0,IN0014702296
PAR DRUGS AND CHEMICALS LIMITED,2819.0,IN511270FI
PAR FORMULATIONS PRIVATE LIMITED,3844.0,IN0007081353
PARADEEP PARIVAHAN PRIVATE LIMITED,4789.0,IN0006944465
PARAG AGRO FOODS AND ALLIED PRODUCTS PRIVATE LIMITED,2091.0,IN0013823641
PARAGON DIGITAL SERVICES PRIVATE LIMITED,7311.0,IN0007007049
PARALLEL WIRELESS INDIA PRIVATE LIMITED,7375.0,IN0014256181
PARAMESU BIOTECH PRIVATE LIMITED,2834.0,IN0007011952
PARAMOUNT TEXTILE MILLS PRIVATE LIMITED,2281.0,IN0007017339
PARAYIL FOOD PRODUCTS PRIVATE LIMITED,5141.0,IN0007112841
PAREXEL INTERNATIONAL (INDIA) PRIVATE LIMITED,7389.0,IN0007117271
PAREXEL INTERNATIONAL INDIA SAFETY SERVICES PRIVATE LIMITED,7371.0,IN0008201146
PARK MEDI WORLD PRIVATE LIMITED,8062.0,IN0007110715
PARK MEDICENTERS AND INSTITUTIONS PRIVATE LIMITED,7389.0,IN0007110698
PARKER ENGINEERING (INDIA) PRIVATE LIMITED,3569.0,IN0007112613
PARSA KENTE COLLIERIES LIMITED,1222.0,IN0000374743
PATCO PRECISION COMPONENTS PRIVATE LIMITED,3561.0,IN0007146599
PATEL INFRASTRUCTURE LIMITED,1629.0,IN0007148571
PATH2WAY HR SOLUTIONS PRIVATE LIMITED,8111.0,IN0017623054
PATNAIK MINERALS PRIVATE LIMITED,1099.0,IN0007156011
PATRA INDIA BPO SERVICES PRIVATE LIMITED,7371.0,IN0007156201
PAWANSHREE FOOD INTERNATIONAL PRIVATE LIMITED,2041.0,IN0011215707
PEEKAY PETROCHEM PRIVATE LIMITED,5085.0,IN0007069431
PEEKAY STEEL CASTINGS PRIVATE LIMITED,3321.0,IN0007069288
PEGASUS PANELS PRIVATE LIMITED,2435.0,IN0015076243
PEGASYSTEMS WORLDWIDE INDIA PRIVATE LIMITED,7371.0,IN0013242175
PEN INDIA LIMITED,7371.0,IN0007077215
