Name,SIC,BVD,Industry
AAVANTIKA GAS LIMITED,4922.0,IN0000406739,"Transportation, Communications, Electric, Gas, and Sanitary Services"
ACCESS HEALTHCARE SERVICES PRIVATE LIMITED,8711.0,IN0000416362,Services
ADANI GREEN ENERGY LIMITED,4931.0,IN999003FI,"Transportation, Communications, Electric, Gas, and Sanitary Services"
ADANI HARBOUR SERVICES LIMITED,4412.0,IN0000378878,"Transportation, Communications, Electric, Gas, and Sanitary Services"
AFFLE (INDIA) LTD,7319.0,IN001037176IND,Services
AFFORDABLE ROBOTIC & AUTOMATION LIMITED,3711.0,IN897186FI,Manufacturing
AKRY ORGANICS PVT LTD,2869.0,IN0001060236,Manufacturing
ALLEGION INDIA PRIVATE LIMITED,8721.0,IN0012153694,Services
ALUFLUORIDE LIMITED,3355.0,IN31219FI,Manufacturing
AMAZON DATA SERVICES INDIA PRIVATE LIMITED,7374.0,IN0015803827,Services
AVENUE SUPERMARTS LIMITED,5999.0,IN001576308IND,Retail Trade
BETA DRUGS LIMITED,2834.0,IN117718FI,Manufacturing
BITZER INDIA PRIVATE LIMITED,7389.0,IN0001689983,Services
CAMBRO NILKAMAL PRIVATE LIMITED,5199.0,IN0001890652,Wholesale Trade
CANTABIL RETAIL INDIA LIMITED,2399.0,IN34666FI,Manufacturing
CARL ZEISS INDIA (BANGALORE) PRIVATE LIMITED,3812.0,IN0001920959,Manufacturing
CHAMUNDI DIE CAST PRIVATE LIMITED,3331.0,IN0001994123,Manufacturing
COHNREZNICK PROFESSIONAL SERVICES PRIVATE LIMITED,7374.0,IN0006617014,Services
CONVERGINT INDIA PRIVATE LIMITED,3669.0,IN0000399919,Manufacturing
CONVONIX SYSTEMS PRIVATE LIMITED,4899.0,IN0010258883,"Transportation, Communications, Electric, Gas, and Sanitary Services"
DEWAS BHOPAL CORRIDOR PRIVATE LIMITED,1611.0,IN0002383728,Construction
DOWELLS CABLE ACCESSORIES PRIVATE LIMITED,3462.0,IN0016583947,Manufacturing
DREAMFOLKS SERVICES LIMITED,5085.0,IN001244972IND,Wholesale Trade
EQUIFAX CREDIT INFORMATION SERVICES PRIVATE LIMITED,7374.0,IN0002582748,Services
EXPERT GLOBAL SOLUTIONS PRIVATE LIMITED,7375.0,IN0002715871,Services
FIRSTRAND SERVICES PRIVATE LIMITED,7371.0,IN0014544156,Services
FLEXIBLE STEEL LACING COMPANY PRIVATE LIMITED,8712.0,IN0002884949,Services
FOSROC CHEMICALS (INDIA) PRIVATE LIMITED,2813.0,IN0002929409,Manufacturing
FUJI SILVERTECH CONCRETE PRIVATE LIMITED,3272.0,IN0014381987,Manufacturing
G.G AUTOMOTIVE GEARS LIMITED,5013.0,IN35895FI,Wholesale Trade
GENESIS LA MODE PRIVATE LIMITED,5199.0,IN0003117973,Wholesale Trade
GEP SOLUTIONS PRIVATE LIMITED,7375.0,IN0003135598,Services
GLOBETROTTERS EDUCATIONAL INNOVENTIONS PRIVATE LIMITED,8299.0,IN0003197626,Services
GML INDIA FASHION PRIVATE LIMITED,5131.0,IN0013012997,Wholesale Trade
GMM PFAUDLER LIMITED,3569.0,IN31937FI,Manufacturing
GOODLUCK INDIA LTD.,3317.0,IN33307FI,Manufacturing
ICE MT INDIA PRIVATE LIMITED,7375.0,IN0005444635,Services
IGUS (INDIA) PRIVATE LIMITED,3567.0,IN0003702166,Manufacturing
INTEGRA ENGINEERING (INDIA) LTD,3559.0,IN33983FI,Manufacturing
INTERGLOBE TECHNOLOGY QUOTIENT PRIVATE LIMITED,7389.0,IN0003893143,Services
INVESTEC CAPITAL SERVICES (INDIA) PRIVATE LIMITED,6019.0,IN0003909984,"Finance, Insurance, and Real Estate"
JEWELLERY GARDEN PRIVATE LIMITED,3312.0,IN0004121041,Manufacturing
KEI INDUSTRIES LIMITED,3357.0,IN30982FI,Manufacturing
KINGFA SCIENCE & TECHNOLOGY (INDIA) LTD.,3087.0,IN31297FI,Manufacturing
KPMG RESOURCE CENTRE PRIVATE LIMITED,8742.0,IN0004698613,Services
KRONOS SOLUTIONS INDIA PRIVATE LIMITED,3571.0,IN0004753014,Manufacturing
MARELLI MOTHERSON AUTOMOTIVE LIGHTING INDIA PRIVATE LIMITED,3694.0,IN0009236639,Manufacturing
MASHREQ GLOBAL SERVICES PRIVATE LIMITED,7371.0,IN0010067272,Services
NARAYANA HRUDAYALAYA LIMITED,5047.0,IN117411FI,Wholesale Trade
NNE PRIVATE LIMITED,5085.0,IN0007429914,Wholesale Trade
NXP INDIA PRIVATE LIMITED,7375.0,IN0002947248,Services
P.P. JEWELLERS RETAIL PRIVATE LIMITED,5944.0,IN0014891199,Retail Trade
PARMESHWARI SILK MILLS LTD,2299.0,IN117606FI,Manufacturing
PRICEWATERHOUSECOOPERS SERVICE DELIVERY CENTER (BANGALORE) PRIVATE LIMITED,7375.0,IN0012980761,Services
RACL GEARTECH LTD,7549.0,IN31980FI,Services
RECAERO INDIA PRIVATE LIMITED,3511.0,IN0006528987,Manufacturing
RIELLO POWER INDIA PRIVATE LIMITED,4911.0,IN0006638753,"Transportation, Communications, Electric, Gas, and Sanitary Services"
RISHABH SOFTWARE PRIVATE LIMITED,7371.0,IN0006826084,Services
SAFARI INDUSTRIES (INDIA) LIMITED,2821.0,IN32515FI,Manufacturing
SAR HEALTH LINE PRIVATE LIMITED,8062.0,IN0011045441,Services
SAWANSUKHA JEWELLERS PVT LTD,5094.0,IN0012919766,Wholesale Trade
SGS TEKNIKS MANUFACTURING PRIVATE LIMITED,3648.0,IN0005942633,Manufacturing
SHISH INDUSTRIES LIMITED,3089.0,IN117688FI,Manufacturing
SHRUTI FASHIONS PRIVATE LIMITED,2281.0,IN0012737293,Manufacturing
SIDWAL REFRIGERATION INDUSTRIES PRIVATE LIMITED,3564.0,IN0013530276,Manufacturing
SOLAS MARINE SERVICES PRIVATE LIMITED,7699.0,IN0006201883,Services
SUYOG ELECTRICALS LIMITED,3679.0,IN0009627171,Manufacturing
SWADESHI POLYTEX LIMITED,6531.0,IN34395FI,"Finance, Insurance, and Real Estate"
TATA MOTORS INSURANCE BROKING AND ADVISORY SERVICES LIMITED,5013.0,IN0000277918,Wholesale Trade
TATA POWER RENEWABLE ENERGY LIMITED,4911.0,IN0008921901,"Transportation, Communications, Electric, Gas, and Sanitary Services"
TEKION INDIA PRIVATE LIMITED,7378.0,IN0015595493,Services
TRAVEL DESIGNER INDIA PRIVATE LIMITED,4724.0,IN0005705961,"Transportation, Communications, Electric, Gas, and Sanitary Services"
TRELLEBORG INDIA PRIVATE LIMITED,3069.0,IN0005712638,Manufacturing
TRENT LIMITED,5999.0,IN30407FI,Retail Trade
TRESVISTA FINANCIAL SERVICES PRIVATE LIMITED,8742.0,IN0005725289,Services
TRIPURA NATURAL GAS CO LTD,2999.0,IN0005751143,Manufacturing
UC INCLUSIVE CREDIT PRIVATE LIMITED,6019.0,IN0016129782,"Finance, Insurance, and Real Estate"
UNITED BREWERIES LIMITED,2082.0,IN30240FI,Manufacturing
V 2 TECH VENTURES PRIVATE LIMITED,7389.0,IN0009230891,Services
VIJAY TECHNNOCRATS PRIVATE LIMITED,3321.0,IN0005321788,Manufacturing
VIVA COMPOSITE PANEL PRIVATE LIMITED,3499.0,IN0010544635,Manufacturing
VOLKSWAGEN GROUP TECHNOLOGY SOLUTIONS INDIA PRIVATE LIMITED,7375.0,IN0015195503,Services
WOOD GROUP PSN INDIA PRIVATE LIMITED,1311.0,IN0012915182,Mining
WSP CONSULTANTS INDIA PRIVATE LIMITED,7371.0,IN0005076344,Services
